{
  "id": "refunds-eu:v17#p4",
  "slot": "evidence.knowledge",
  "source": "policy-corpus",
  "source_version": "2026-09-10",
  "authority": "reference_only",
  "trust": "verified",
  "freshness": "2026-09-12T15:30:00Z",
  "expires": "2026-12-12T15:30:00Z",
  "scope": {
    "tenant": "acme",
    "task": "refund_request"
  },
  "relevance": 0.91,
  "token_budget": 420,
  "tier": "compressible",
  "variants": [],
  "conflict_policy": "defers",
  "injection_risk": "untrusted_content",
  "lineage": "verbatim",
  "eligibility": "support-chat/illustrative/v1: tenant acme; rerank at least 0.5",
  "body": "Pro plans refund in full within 30 days of purchase."
}
